,IntervieweeName,Intro  ,IsIrani,IsForein,Palement,Lawyer,Press,Prime,ForeignAffairs,Minister,BankEco,Bussiness,Diplomat,Military,IsProfessor,Field,University,Party,IsShahGov,IsShahOpp,PreRevolution,PostRevolution,Activist
98,دنیس رایت ,"دیپلمات انگلستان در ایران 1953- 1957 میلادی
سفیر بریتانیا در ایران 1963- 1971 میلادی ",0,1,0,0,0,0,0,0,0,0,1,0,0,0,0,0,0,0,1,0,0
99,پیتر رمزباتم ,سفیر انگلیس در ایران 1971- 1974 میلادی ,0,1,0,0,0,0,0,0,0,0,1,0,0,0,0,0,0,0,1,0,0
100,مهدی ضرغامی ,"نایب التولیه دانشگاه صنعتی آریامهر 
موسس دانشگاه صنعتی اصفهان 
مدیر شرکت صنایع ملی مس ایران 
عضو هیات امنای بنیاد دانشنامه ایرانیکا ",1,0,0,0,0,0,0,0,0,1,0,0,1,0,0,0,1,0,1,0,0
101,خداداد فرمانفرمائیان ,"رئیس بانک مرکزی 1347 شمسی 
رئیس سازمان برنامه و بودجه ایران 1349 - 1351 شمسی 
عضو شورای عالی پول و اعتبار شورای عالی اقتصاد ",1,0,0,0,0,0,0,0,1,0,0,0,0,0,0,0,1,0,1,0,0
102,مظفر فیروز ,"وزیر کار 1352 شمسی 
سفیر ایران در شوروی 1326 شمسی ",1,0,0,0,0,0,0,1,0,0,0,0,0,0,0,0,1,0,1,0,0
103,حمید قاجار ,"فرزند آخرین ولیعهد سلسله قاجار محمدحسن میرزا 
شاغل در کنسرسیوم نفت ",1,0,0,0,0,0,0,0,0,0,0,0,0,0,0,0,1,0,1,0,0
104,کامران کاشانی ,دانشیار مرکز مطالعات مدیریت ایران ,1,0,0,0,0,0,0,0,0,0,0,0,1,0,0,0,0,0,1,0,0
105,جرج میدلتون ,"دیپلمات انگلیسی 
کاردار سفارت بریتانیا در تهران ",0,1,0,0,0,0,0,0,0,0,1,0,0,0,0,0,0,0,1,0,0
106,ویلیام میلر,دیپلمات امریکایی در ایران در سال های 1959 - 1964 میلادی ,0,1,0,0,0,0,0,0,0,0,1,0,0,0,0,0,0,0,1,0,0
107,بدری آتابای کامروز,رییس کتابخانه سلطنتی,1,0,0,0,0,0,0,0,0,0,0,0,0,0,0,0,1,0,1,0,0
